{
  "bot_name": "DrawdownDaddy",
  "telegram_token": "YOUR_BOT_TOKEN_HERE",
  "alert_chat_id": "YOUR_GROUP_CHAT_ID_HERE",
  "database": "data/bot-1.db",
  "logs": "logs/bot-1",
  "features": {
    "watchlist":    true,
    "alerts":       true,
    "price_alerts": true,
    "holdings":     true,
    "reports":      true
  },
  "settings": {
    "alert_cooldown_hours":        2,
    "check_interval_market_hours": 1800,
    "check_interval_off_hours":    3600
  }
}
